Name,Type,Show,Date,Location,Confirmed,Link,Micro.blog URL
Carvel: Clean Tools for Cloud Native Problems,Video,⚡️Enlightning,1/5/2023,,,https://www.youtube.com/watch?v=gsyGOv_Nwb0,
Own Your Images with Harbor!,Video,⚡️Enlightning,1/20/2023,,,https://www.youtube.com/watch?v=mXwslv2VAbY,
What Is cdk8s?,Video,⚡️Enlightning,2/3/2023,,,https://www.youtube.com/watch?v=GCZgLmksJW8,
You're at the Helm,Video,⚡️Enlightning,2/10/2023,,,https://www.youtube.com/watch?v=oPIiX6vyih8,
De-stress Certificates with cert-manager!,Video,⚡️Enlightning,2/24/2023,,,https://www.youtube.com/watch?v=DthwYI46DYo,
Remocal K8s Development FTW: Telepresence 101,Video,⚡️Enlightning,3/3/2023,,,https://www.youtube.com/watch?v=VLABvVtUZvk,
Declarative Database Schema Migrations with SchemaHero,Video,⚡️Enlightning,3/10/2023,,,https://www.youtube.com/watch?v=uzWBaqPxxH8,
Kustomize Demystified,Video,⚡️Enlightning,3/11/2023,,,https://www.youtube.com/watch?v=C8DpFc4zw80,
Self-Service Traffic Management with Emissary-ingress,Video,⚡️Enlightning,3/17/2023,,,https://www.youtube.com/watch?v=NpCEh09mOJI,
Develop at Lightning Speed on Kubernetes with DevSpace,Video,⚡️Enlightning,3/18/2023,,,https://www.youtube.com/watch?v=_xIm10LkmMk,
"Signed, Sealed, Delivered, I’m Yours! An Introduction to Sigstore",Video,⚡️Enlightning,3/23/2023,,,https://www.youtube.com/watch?v=8GKFzJaEHac,
What Is Carvel kapp-controller?,Video,⚡️Enlightning,3/30/2023,,,https://www.youtube.com/watch?v=Bc0VrKQsJAo,
Software Defined Cloud Dev Environments with the Devfile,Video,⚡️Enlightning,4/1/2023,,,https://www.youtube.com/watch?v=eGFdEXw9eLE,
Embark on a Journey with KubeVela: A Modern Application Delivery Platform,Video,⚡️Enlightning,4/14/2023,,,https://www.youtube.com/watch?v=pYDk6_riTDo,
What Is Cluster API?,Video,⚡️Enlightning,5/11/2023,,,https://www.youtube.com/watch?v=ubjwT9Jcgz0,
What Is ingress-nginx?,Video,⚡️Enlightning,5/18/2023,,,https://www.youtube.com/watch?v=G-m9mB4y3Og,
What Is ingress-nginx?,Video,⚡️Enlightning,5/18/2023,,,https://www.youtube.com/watch?v=G-m9mB4y3Og,
Implementing Ingress with Contour,Video,⚡️Enlightning,5/19/2023,,,https://www.youtube.com/watch?v=oFGyqG_7jTU,
Open Policy Agent and Rego - the Policy Power Duo!,Video,⚡️Enlightning,6/2/2023,,,https://www.youtube.com/watch?v=FlVBw5PNKZQ,
No-Code Policy with Kyverno,Video,⚡️Enlightning,6/3/2023,,,https://www.youtube.com/watch?v=JsHA1UTxLHQ,
What Is Gateway API?,Video,⚡️Enlightning,6/8/2023,,,https://www.youtube.com/watch?v=mFZW4jyed68,
Armoring up Your Workloads with KubeArmor,Video,⚡️Enlightning,6/10/2023,,,https://www.youtube.com/watch?v=2ZVr64O8R-E,
"Kubewarden, the Universal Policy Framework",Video,⚡️Enlightning,6/15/2023,,,https://www.youtube.com/watch?v=bLQ_mtbNRUY,
"Playing ""Guess Who?"" – Detecting Threats With Falco",Video,⚡️Enlightning,6/17/2023,,,https://www.youtube.com/watch?v=ZIk41-zBbX8,
What Is ValidatingAdmissionPolicy in Kubernetes?,Video,⚡️Enlightning,6/29/2023,,,https://www.youtube.com/watch?v=Cw_GE6nQPiY,
Exploring External Secrets Operator,Video,⚡️Enlightning,6/30/2023,,,https://www.youtube.com/watch?v=7uY_qW6TWf8,
Cloud Custodian: Governance as Code That Developers Love,Video,⚡️Enlightning,7/15/2023,,,https://www.youtube.com/watch?v=lv7wR6M9CWk,
Keeping Secrets Secret: Secrets Store CSI Driver,Video,⚡️Enlightning,8/4/2023,,,https://www.youtube.com/watch?v=vOJK2BwR3zc,
Ensuring Software Authenticity: Introduction to Notary Project,Video,⚡️Enlightning,8/31/2023,,,https://www.youtube.com/watch?v=FwpHZfNE9LQ,
Kubernetes Networking,Video,⚡️Enlightning,9/7/2023,,,https://www.youtube.com/watch?v=V9ItB3u4UaA,
Linkerd: The Stress-Free Service Mesh,Video,⚡️Enlightning,10/6/2023,,,https://www.youtube.com/watch?v=1xzUFBkGPZI,
Learn Service Mesh With Kuma,Video,⚡️Enlightning,10/12/2023,,,https://www.youtube.com/watch?v=2_UbxGdJCcw,
Sailing Into a Sea of Microservices With Istio,Video,⚡️Enlightning,10/19/2023,,,https://www.youtube.com/watch?v=CBzqXniYouU,
"Cilium Networking, Security and Observability",Video,⚡️Enlightning,11/30/2023,,,https://www.youtube.com/watch?v=KIWQTolF-3g,
What Is Dex?,Video,⚡️Enlightning,12/16/2023,,,https://www.youtube.com/watch?v=99YWNJa7SfE,