Name,Type,Show,Date,Location,Confirmed,Link,Micro.blog URL
What is etcd?,Video,IBM Cloud,8/25/2020,,,https://www.youtube.com/watch?v=OmphHSaO1sE,
What is Kafka?,Video,IBM Cloud,9/18/2020,,,https://www.youtube.com/watch?v=aj9CDZm0Glc,
What is API Management?,Video,IBM Cloud,10/8/2020,,,https://www.youtube.com/watch?v=fh3VaXLzH5Y,
What is RabbitMQ?,Video,IBM Cloud,11/10/2020,,,https://www.youtube.com/watch?v=7rkeORD4jSw,
Architecting a Cloud Native API Solution,Video,IBM Cloud,2/18/2021,,,https://www.youtube.com/watch?v=sKfep-UmZeM,
How does Kubernetes create a Pod?,Video,IBM Cloud,4/20/2021,,,https://www.youtube.com/watch?v=BgrQ16r84pM,
What is Event Driven Architecture (EDA)?,Video,IBM Cloud,5/21/2021,,,https://www.youtube.com/watch?v=o2HJCGcYwoU,
TGI Kubernetes 184: kpack,Guest,TGI Kubernetes,2/5/2022,,,https://www.youtube.com/watch?v=ShE_j4V_2iQ,
Dockerfiles vs Cloud Native Buildpacks,Video,⚡️Enlightning,2/17/2022,,,https://www.youtube.com/watch?v=vfhfJ98ApwE,
Who Should Use Kubernetes?,Video,⚡️Enlightning,3/1/2022,,,https://www.youtube.com/watch?v=DjNFiEBOrGY,
How Do You Structure Learning for Technical Concepts?,Video,⚡️Enlightning,3/4/2022,,,https://www.youtube.com/watch?v=r_SPWqB1l-c,
How Do You Deploy a Stateless Application on Kubernetes?,Video,⚡️Enlightning,3/11/2022,,,https://www.youtube.com/watch?v=UgzIwoxX7Wg,
How Do You Add Persistent Storage to Your Kubernetes Application?,Video,⚡️Enlightning,3/18/2022,,,https://www.youtube.com/watch?v=q9pYsss8huk,
What Is Knative Serving?,Video,⚡️Enlightning,3/24/2022,,,https://www.youtube.com/watch?v=Z9epsn52M6s,
What Is Knative Eventing?,Video,⚡️Enlightning,4/8/2022,,,https://www.youtube.com/watch?v=eRKR53nOKyA,
Security For Application Developers,Video,⚡️Enlightning,4/29/2022,,,https://www.youtube.com/watch?v=g1Bmxg4DSug,
Getting Your Code to Production with Cartographer,Video,⚡️Enlightning,5/5/2022,,,https://www.youtube.com/watch?v=RKP3xvWphFg,
"The Past, Present and Future of the Knative Community",Presentation,KubeCon - Knative Day,5/19/2022,,,https://www.youtube.com/watch?v=W5tEOTmHkEQ,
What Is Observability?,Video,⚡️Enlightning,5/23/2022,,,https://www.youtube.com/watch?v=-fCOxnu6FYA,
Charting Your Own Course Through the Cloud Native Landscape - Matty Stratton & Whitney Lee,Presentation,Kubecon EU Valencia,6/1/2022,,,https://www.youtube.com/watch?v=dzcij4jDNbs,
Event-Driven Architecture and Real-Time Analytics,Video,⚡️Enlightning,6/9/2022,,,https://www.youtube.com/watch?v=WTZmTcvDAB8,
What Should Application Developers Know about Metrics?,Video,⚡️Enlightning,6/16/2022,,,https://www.youtube.com/watch?v=MFhgCHAUkDw,
HumanOps: Organizing Community Around Technology,Video,⚡️Enlightning,6/24/2022,,,https://www.youtube.com/watch?v=qeW9epuirzU,
There’s More to ‘Infrastructure as Code’ than Code,Video,⚡️Enlightning,7/8/2022,,,https://www.youtube.com/watch?v=X2EcLX_R6QQ,
Crossplane: Control Plane of Control Planes,Video,⚡️Enlightning,7/29/2022,,,https://www.youtube.com/watch?v=CHBA34a0KEQ,
Serverless On Kubernetes - Ask Me Anything,Guest,DevOps Toolkit,7/29/2022,,,https://www.youtube.com/watch?v=Nv1qWibfsSw,
What Is Argo CD?,Video,⚡️Enlightning,8/4/2022,,,https://www.youtube.com/watch?v=fQ9846hRiFo,
What Are Cloud Native Buildpacks and How Do They Work?,Video,⚡️Enlightning,8/12/2022,,,https://www.youtube.com/watch?v=-n9H8KnYjVI,
Now You Git It!,Video,⚡️Enlightning,8/18/2022,,,https://www.youtube.com/watch?v=OedzEb5HVPs,
What Is Tekton?,Video,⚡️Enlightning,8/25/2022,,,https://www.youtube.com/watch?v=7bMwcbRBv2Y,
Delivering Your Platform Your Way Using Kratix,Video,⚡️Enlightning,9/9/2022,,,https://www.youtube.com/watch?v=YS8PLrBhUCQ,
What the Flux?!  GitOps at Your Fingertips,Video,⚡️Enlightning,9/22/2022,,,https://www.youtube.com/watch?v=_8Zobz7qbqo,
Who Should Use Kubernetes? - Whitney Lee,Presentation,Presentations & Guest Appearances,9/28/2022,,,https://www.youtube.com/watch?v=KgM1rve4N0g,
"Oh Keptn, My Keptn!",Video,⚡️Enlightning,10/14/2022,,,https://www.youtube.com/watch?v=lb5ORMXdI5c,
"Lightning Talk: Tales from the Road: The Questions Being Asked About Knative - Whitney Lee, VMware",Presentation,Kubecon - Knative Day,10/28/2022,,,https://www.youtube.com/watch?v=wJa8XKiYcqI,
Live diagramming of knative core concepts,Presentation,JBCN,11/6/2022,,,https://www.youtube.com/watch?v=1FgAEuyWzNQ,
Empower Your Dev Teams with Virtual Clusters!,Video,⚡️Enlightning,11/11/2022,,,https://www.youtube.com/watch?v=wMmUmjSB6hw,
Keynote: What a RUSH! Let’s Deploy Straight to Production! - Whitney Lee & Mauricio Salatino,Presentation,KubeCon NA Detroit,11/12/2022,,Keynote,https://www.youtube.com/watch?v=eJG7uIU9NpM,
Trauma-Free Incident Management,Video,⚡️Enlightning,11/18/2022,,,https://www.youtube.com/watch?v=cUsoXMFWaww,
What Is OpenTelemetry?,Video,⚡️Enlightning,12/9/2022,,,https://www.youtube.com/watch?v=QUVN0Sr8hF0,
Carvel: Clean Tools for Cloud Native Problems,Video,⚡️Enlightning,1/5/2023,,,https://www.youtube.com/watch?v=gsyGOv_Nwb0,
The world of VMware GemFire,Video,VMware Tanzu YouTube,1/6/2023,,,https://www.youtube.com/watch?v=2XxjirV4ymE,
Kubernetes with no YAML and no Dockerfile! How do I get that!?,Podcast,Ship It!,1/14/2023,,,https://www.youtube.com/watch?v=FuZ39CRrzIE,
Own Your Images with Harbor!,Video,⚡️Enlightning,1/20/2023,,,https://www.youtube.com/watch?v=mXwslv2VAbY,
"The Adventure Begins (You Choose! Ch. 1, Ep. 0)",Video,You Choose!,2/2/2023,,,https://www.youtube.com/watch?v=JfXidOXa7As,
What Is cdk8s?,Video,⚡️Enlightning,2/3/2023,,,https://www.youtube.com/watch?v=GCZgLmksJW8,
"Build Container Image - Feat. Carvel kbld, Buildpacks, and Lima (You Choose!, Ch. 1, Ep. 1)",Video,You Choose!,2/9/2023,,,https://www.youtube.com/watch?v=GDInFocQJTU,
You're at the Helm,Video,⚡️Enlightning,2/10/2023,,,https://www.youtube.com/watch?v=oPIiX6vyih8,
"Store Image in a Registry - Feat. Harbor, Docker Hub, and Dragonfly (You Choose!, Ch. 1, Ep. 2)",Video,You Choose!,2/15/2023,,,https://www.youtube.com/watch?v=QP8xGYwevKo,
"Define And Deploy Apps - Feat. Helm, Kustomize, Carvel ytt, and cdk8s (You Choose!, Ch. 1, Ep. 3)",Video,You Choose!,2/22/2023,,,https://www.youtube.com/watch?v=QwU3JmjyKoM,
De-stress Certificates with cert-manager!,Video,⚡️Enlightning,2/24/2023,,,https://www.youtube.com/watch?v=DthwYI46DYo,
"Use HTTPS - Feat. cert-manager (You Choose!, Ch. 1, Ep. 4)",Video,You Choose!,3/1/2023,,,https://www.youtube.com/watch?v=sSbe6qedElE,
Remocal K8s Development FTW: Telepresence 101,Video,⚡️Enlightning,3/3/2023,,,https://www.youtube.com/watch?v=VLABvVtUZvk,
"Setup PostgreSQL DB In The Dev Environment - Feat. Helm And Crossplane (You Choose!, Ch. 1, Ep. 5)",Video,You Choose!,3/8/2023,,,https://www.youtube.com/watch?v=ITBPHJBbjPY,
Building Internal Developer Platforms (IDPs) with Crossplane and Flux | ft. Viktor Farcic,Guest,Containers from the Couch,3/9/2023,,,https://www.youtube.com/watch?v=jIVMJ0NbqtE,
Declarative Database Schema Migrations with SchemaHero,Video,⚡️Enlightning,3/10/2023,,,https://www.youtube.com/watch?v=X0wbq7-VwdI,
Kustomize Demystified,Video,⚡️Enlightning,3/11/2023,,,https://www.youtube.com/watch?v=ZI7rsQ2LLHs,
"Manage DB Schema - Feat. SchemaHero And Liquibase (You Choose!, Ch. 1, Ep. 6)",Video,You Choose!,3/14/2023,,,https://www.youtube.com/watch?v=6YW2__HUHxw,
Self-Service Traffic Management with Emissary-ingress,Video,⚡️Enlightning,3/17/2023,,,https://www.youtube.com/watch?v=XT2NQ4IZwNo,
Develop at Lightning Speed on Kubernetes with DevSpace,Video,⚡️Enlightning,3/18/2023,,,https://www.youtube.com/watch?v=T_NYcuqUCF0,
"Develop Apps - Feat. Telepresence, DevSpace, Nocalhost, And Devfile (You Choose!, Ch. 1, Ep. 7)",Video,You Choose!,3/22/2023,,,https://www.youtube.com/watch?v=YqmLIh31VH0,
"Signed, Sealed, Delivered, I’m Yours! An Introduction to Sigstore",Video,⚡️Enlightning,3/23/2023,,,https://www.youtube.com/watch?v=Q726pjHLsiE,
"Development Finale - Feat. Everyone (You Choose!, Ch. 1, Ep. 8)",Video,You Choose!,3/29/2023,,,https://www.youtube.com/watch?v=SV1uu4h0vuQ,
What Is Carvel kapp-controller?,Video,⚡️Enlightning,3/30/2023,,,https://www.youtube.com/watch?v=ojFG8h5Ht70,
Software Defined Cloud Dev Environments with the Devfile,Video,⚡️Enlightning,4/1/2023,,,https://www.youtube.com/watch?v=65qbpPW38xs,
Who Should Use Kubernetes?,Presentation,SpringOne,4/12/2023,,,https://www.youtube.com/watch?v=ed5zYmf-hYw,
DevOps Speakeasy with Whitney Lee @wiggitywhitney,Guest,DevOps Speakeasy,4/13/2023,,,https://www.youtube.com/watch?v=kHNp3MtC7XQ,
Embark on a Journey with KubeVela: A Modern Application Delivery Platform,Video,⚡️Enlightning,4/14/2023,,,https://www.youtube.com/watch?v=zZQsZk365wU,
DOP 208: KubeCon EU 2023 Review,Guest,DevOps Paradox,4/26/2023,,,https://www.youtube.com/watch?v=fY4cfKjY1nU,
Choose Your Own Adventure: The Treacherous Trek to Development - Whitney Lee & Viktor Farcic,Presentation,KubeCon EU Amsterdam,5/1/2023,,,https://www.youtube.com/watch?v=gZdEvlW-XHY,
What Is Cluster API?,Video,⚡️Enlightning,5/11/2023,,,https://www.youtube.com/watch?v=SWj_DmiUvbc,
“You Choose” Chapter 1 Recap  with Whitney Lee! | Ep 75 | #womensincloudnative,Guest,Cloud Native Podcast,5/11/2023,,,https://www.youtube.com/watch?v=pymXq0SDaA4,
How To Fight Misconfiguration & Bad Intentions With K8s Validating Admission Policy & Crossplane,Presentation,Cloud Native Rejekts,5/11/2023,,,https://www.youtube.com/watch?v=B8f_b8pkBGw,
Devnexus 2023 - Live Diagramming of Knative - Core Concepts - Whitney Lee,Presentation,Devnexus,5/15/2023,,,https://www.youtube.com/watch?v=zoAG1oatOS0,
What Is ingress-nginx?,Video,⚡️Enlightning,5/18/2023,,,https://www.youtube.com/watch?v=ly_zzKR_alA,
Implementing Ingress with Contour,Video,⚡️Enlightning,5/19/2023,,,https://www.youtube.com/watch?v=zFx7gdM7xpQ,
Cloud Native Live: What's new in Kyverno!,Video,Cloud Native Live,6/1/2023,,,https://www.youtube.com/watch?v=cGE7HAhwNcY,
Open Policy Agent and Rego - the Policy Power Duo!,Video,⚡️Enlightning,6/2/2023,,,https://www.youtube.com/watch?v=QNX5JfV390c,
No-Code Policy with Kyverno,Video,⚡️Enlightning,6/3/2023,,,https://www.youtube.com/watch?v=ytB_PVCMX9s,
What Is Gateway API?,Video,⚡️Enlightning,6/8/2023,,,https://www.youtube.com/watch?v=G_5tRFY6N_k,
Armoring up Your Workloads with KubeArmor,Video,⚡️Enlightning,6/10/2023,,,https://www.youtube.com/watch?v=fHSw-CuYgoY,
"Kubewarden, the Universal Policy Framework",Video,⚡️Enlightning,6/15/2023,,,https://www.youtube.com/watch?v=HFyLICfbhy8,
"Playing ""Guess Who?"" – Detecting Threats With Falco",Video,⚡️Enlightning,6/17/2023,,,https://www.youtube.com/watch?v=ojcMrXiid-I,
What Is ValidatingAdmissionPolicy in Kubernetes?,Video,⚡️Enlightning,6/29/2023,,,https://www.youtube.com/watch?v=tZGjr2Kwpls,
The Treacherous Trek to Development • Whitney Lee & Viktor Farcic • GOTO 2023,Presentation,GOTO,6/29/2023,,,https://www.youtube.com/watch?v=vsW8TFjNbpE,
Cloud Native Live: IaC Migration using AI,Video,Cloud Native Live,6/29/2023,,,https://www.youtube.com/watch?v=udoLHw97QL0,
Exploring External Secrets Operator,Video,⚡️Enlightning,6/30/2023,,,https://www.youtube.com/watch?v=kK4hwXisW8g,
"The Adventure  Continues Towards Production (You Choose! Ch. 2, Ep. 0)",Video,You Choose!,7/12/2023,,,https://www.youtube.com/watch?v=KyRTsyQuOMY,
CNL: Streamline service mesh observability with Kuma & OpenTelemetry,Video,Cloud Native Live,7/13/2023,,,https://www.youtube.com/watch?v=PLq0It3oRMM,
Cloud Custodian: Governance as Code That Developers Love,Video,⚡️Enlightning,7/15/2023,,,https://www.youtube.com/watch?v=61m5uH_FPtY,
"Provision a Production Cluster - Feat. Crossplane And Cluster API (You Choose!, Ch. 2, Ep. 1)",Video,You Choose!,7/19/2023,,,https://www.youtube.com/watch?v=lzBWIhYC5_E,
CNL: Falco - A peek into the people and the latest features,Video,Cloud Native Live,7/19/2023,,,https://www.youtube.com/watch?v=QzDRDgYQNJs,
Cloud Native Live: Gateway API Plugin for Argo Rollouts 🐙,Video,Cloud Native Live,7/20/2023,,,https://www.youtube.com/watch?v=yRrC4HX__9A,
"GitOps - Feat. Flux, Argo CD, and kapp-controller (You Choose!, Ch. 2, Ep. 2)",Video,You Choose!,7/26/2023,,,https://www.youtube.com/watch?v=4tRYJ0mZf5A,
Cloud Native Live: Policy based governance for Internal Developer platforms,Video,Cloud Native Live,7/27/2023,,,https://www.youtube.com/watch?v=jK2DvieOFjs,
"Ingress - Feat. Contour, NGINX Ingress, and Emissary-ingress (You Choose!, Ch. 2, Ep. 3)",Video,You Choose!,8/2/2023,,,https://www.youtube.com/watch?v=aAyRJy4Gzag,
Keeping Secrets Secret: Secrets Store CSI Driver,Video,⚡️Enlightning,8/4/2023,,,https://www.youtube.com/watch?v=Fn9VLfw5AhE,
"Deploy to Production & Database Implementation (You Choose!, Ch. 2, Ep. 4)",Video,You Choose!,8/9/2023,,,https://www.youtube.com/watch?v=Hw8sSBO3YhI,
CNL: Supercharge Your Infrastructure Management with OPA,Video,Cloud Native Live,8/9/2023,,,https://www.youtube.com/watch?v=KdIw9DzA1Uo,
Ensuring Software Authenticity: Introduction to Notary Project,Video,⚡️Enlightning,8/31/2023,,,https://www.youtube.com/watch?v=GaCAiwb3Mhw,
Cloud Native Live: K8s all the things!,Video,Cloud Native Live,8/31/2023,,,https://www.youtube.com/watch?v=Ki1J2pxAHdQ,
Kubernetes Networking,Video,⚡️Enlightning,9/7/2023,,,https://www.youtube.com/watch?v=3G3BNMTx3bE,
The Power of Traces: Why OpenTelemetry Embraced Trace-Based Testing,Video,Cloud Native Live,9/13/2023,,,https://www.youtube.com/watch?v=2MSDy3XHjtE,
Cloud Native Live: Get more with multi-arch clouds,Video,Cloud Native Live,9/21/2023,,,https://www.youtube.com/watch?v=y_NjFSPmiqs,
An Overview of Authority to Operate (ATO) and Compliance,Video,VMware Tanzu YouTube,9/27/2023,,,https://www.youtube.com/watch?v=elQwuo3m7u4,
Linkerd: The Stress-Free Service Mesh,Video,⚡️Enlightning,10/6/2023,,,https://www.youtube.com/watch?v=iCvw3YFNw0E,
Cloud Native Live: Architect Your Sched,Video,Cloud Native Live,10/6/2023,,,https://www.youtube.com/watch?v=60Fm2KXTtAs,
Learn Service Mesh With Kuma,Video,⚡️Enlightning,10/12/2023,,,https://www.youtube.com/watch?v=PnD_PHfoN_o,
Open Source Connect  Bangladesh : Session 8 with Whitney Lee,Guest,Open Source Connect Bangladesh,10/12/2023,,,https://www.youtube.com/watch?v=Rbm9dDpUO_k,
Keynote: Choose Your Own Adventure: The Perilous Passage to Production - Whitney Lee & Viktor Farcic,Presentation,KubeCon China Shanghai,10/17/2023,,Keynote,https://www.youtube.com/watch?v=RMTgMKpsAws,
Sailing Into a Sea of Microservices With Istio,Video,⚡️Enlightning,10/19/2023,,,https://www.youtube.com/watch?v=W3K2Ufng8Zg,
CNL: Dive into Kubernetes testing techniques with KUTTL & Crossplane,Video,Cloud Native Live,10/19/2023,,,https://www.youtube.com/watch?v=8pu36207KuA,
What a Rush! Let's Deploy Straight to Production,Presentation,SpringOne,10/27/2023,,,https://www.youtube.com/watch?v=quBo0P5K7OA,
Cloud Native Live: 2-node HA for edge Kubernetes — a new approach,Video,Cloud Native Live,11/2/2023,,,https://www.youtube.com/watch?v=HycGtLjlikI,
"Lightning Talk: Secret Word of the Day: Platforms! - Whitney Lee, VMware",Presentation,KubeCon - AppDevCon,11/13/2023,,,https://www.youtube.com/watch?v=HsOnpRfMa4U,
DOP 237: KubeCon North America 2023 Review,Guest,DevOps Paradox,11/15/2023,,,https://www.youtube.com/watch?v=0kzKMoJSdMc,
Security Showdown: The Overconfident Operator Vs the Nefarious N... Whitney Lee & Lewis Denham-Parry,Presentation,KubeCon NA Chicago,11/22/2023,,,https://www.youtube.com/watch?v=Y1rJY_UlLmM,
Humans of Cloud Native Panel – Finding Your Way in #TeamCloudNative,Presentation,KubeCon NA Chicago,11/22/2023,,,https://www.youtube.com/watch?v=cMwjUbDh4Ig,
"Cilium Networking, Security and Observability",Video,⚡️Enlightning,11/30/2023,,,https://www.youtube.com/watch?v=KIWQTolF-3g,
CNL: Cloud native application threat modeling & adversary emulation,Video,Cloud Native Live,11/30/2023,,,https://www.youtube.com/watch?v=wy43lUbDjAk,
Choose Your Own Adventure: The Perilous Passage to Production,Presentation,Cloud Native Rejekts,12/11/2023,,,https://www.youtube.com/watch?v=3P33bFK87gw,
DOP 241: From Restaurant Server to KubeCon Keynote in Under 4 Years,Guest,DevOps Paradox,12/13/2023,,,https://www.youtube.com/watch?v=M03vEbm99Uo,
What Is Dex?,Video,⚡️Enlightning,12/16/2023,,,https://www.youtube.com/watch?v=99YWNJa7SfE,
"The Adventure  Continues Towards Security (You Choose! Ch. 3, Ep. 0)",Video,You Choose!,1/4/2024,,,https://www.youtube.com/watch?v=RAPaS91AY1Q,
Be a Security Hero with Kubescape as Your Sidekick,Video,⚡️Enlightning,1/5/2024,,,https://www.youtube.com/watch?v=8BrEeC6PiiY,
What Is Access Policy Orchestration? What Is Hexa?,Video,⚡️Enlightning,1/6/2024,,,https://www.youtube.com/watch?v=2ylmZCARzsc,
"Admission Controllers - Feat. Kyverno, OPA, Kubewarden, Cloud Custodian, and VAP (Ch. 3, Ep. 1)",Video,You Choose!,1/10/2024,,,https://www.youtube.com/watch?v=NjFy8IfoKco,
Keycloak: The Open Source IAM for Modern Applications,Video,⚡️Enlightning,1/13/2024,,,https://www.youtube.com/watch?v=fqapvuIL6Qs,
"Runtime Policies - Feat. KubeArmor and Falco (You Choose!, Ch. 3, Ep. 2)",Video,You Choose!,1/17/2024,,,https://www.youtube.com/watch?v=ZSNX10soFPw,
"Hello Paralus, Goodbye RBAC Stress!",Video,⚡️Enlightning,1/19/2024,,,https://www.youtube.com/watch?v=lFhL_HFHwOM,
Solving for the Bottom Turtle with SPIFFE and SPIRE,Video,⚡️Enlightning,1/20/2024,,,https://www.youtube.com/watch?v=EB6AJTkspTM,
"Secrets Management - Feat. ESO, SSCSID, Teller, and SOPS (You Choose!, Ch. 3, Ep. 3)",Video,You Choose!,1/24/2024,,,https://www.youtube.com/watch?v=rpNFuT4TCQY,
CNL: Drive AppSec & developer autonomy in the internal developer portal,Video,Cloud Native Live,1/24/2024,,,https://www.youtube.com/watch?v=RTuP8fJnNEE,
Cloud Native Live: Securing the secrets manager with KubeArmor,Video,Cloud Native Live,1/25/2024,,,https://www.youtube.com/watch?v=qLK2Kd4L1Jg,
Understanding Network Service Mesh,Video,⚡️Enlightning,1/26/2024,,,https://www.youtube.com/watch?v=nyfeysBlO5c,
Cloud Native Confidential Computing with Confidential Containers,Video,⚡️Enlightning,1/26/2024,,,https://www.youtube.com/watch?v=Z78KJd7iP8w,
"mTLS and Network Policies - Feat. Istio, Linkerd, Cilium, Kuma, and NSM (You Choose!, Ch. 3, Ep. 4)",Video,You Choose!,1/31/2024,,,https://www.youtube.com/watch?v=zaXhEGrS4Z8,
CNL: Enable Developer Self-Service with Seal Walrus & OpenTofu,Video,Cloud Native Live,1/31/2024,,,https://www.youtube.com/watch?v=zpDOUzR3EWo,
Service Identity Authentication and Authorization Using Athenz,Video,⚡️Enlightning,2/1/2024,,,https://www.youtube.com/watch?v=kz2JXQCdE2w,
Beyond Kubernetes with Linkerd 2.15 and SPIFFE,Video,Cloud Native Live,2/1/2024,,,https://www.youtube.com/watch?v=G1QVXZiMGw4,
"Open Policy Containers: The What, Why, and How",Video,⚡️Enlightning,2/3/2024,,,https://www.youtube.com/watch?v=eYUmBeVCYxQ,
"Kubernetes Scanning - Feat. Kubescape and Snyk (You Choose!, Ch. 3, Ep. 5)",Video,You Choose!,2/7/2024,,,https://www.youtube.com/watch?v=vNcPi1YgZtc,
Flexible Authorization with OpenFGA,Video,⚡️Enlightning,2/9/2024,,,https://www.youtube.com/watch?v=yTgtAzhvC28,
Demystifying the Software Bill Of Materials (SBOM) and why everyone's talking about them,Video,VMware Tanzu YouTube,2/9/2024,,,https://www.youtube.com/watch?v=feArM3MoQos,
"Signing Artifacts - Feat. Notary, Sigstore, and Open Policy Containers (You Choose!, Ch. 3, Ep. 6)",Video,You Choose!,2/14/2024,,,https://www.youtube.com/watch?v=p4M-ZdBsA7o,
Keeping Your Secrets Secure with SOPS,Video,⚡️Enlightning,2/16/2024,,,https://www.youtube.com/watch?v=RAmbUFdBGXk,
"Workload Identity - Feat. SPIFFE, SPIRE, and Athenz (You Choose!, Ch. 3, Ep. 7)",Video,You Choose!,2/21/2024,,,https://www.youtube.com/watch?v=gYq591U8Dac,
Cloud Native Live: Falcosidekick,Video,Cloud Native Live,2/21/2024,,,https://www.youtube.com/watch?v=1ewRLb4cack,
"Authenticating Users - Feat. Dex and Keycloak (You Choose!, Ch. 3, Ep. 8)",Video,You Choose!,2/28/2024,,,https://www.youtube.com/watch?v=_CYiksI_89E,
Cloud Native Live: How to design Database-as-a-Service (DBaaS)?,Video,Cloud Native Live,3/1/2024,,,https://www.youtube.com/watch?v=BpvBuPRqX1w,
"Authorizing Access - Feat. Hexa, Paralus, and OpenFGA (You Choose!, Ch. 3, Ep. 9)",Video,You Choose!,3/6/2024,,,https://www.youtube.com/watch?v=VyHbFwfrf04,
What do pigs in lipstick have to do with platform engineering?,Guest,Syntasso,3/11/2024,,,https://www.syntasso.io/post/what-do-pigs-in-lipstick-have-to-do-with-platform-engineering,
"Misfits - Feat. ContainerSSH and Confidential Containers (You Choose!, Ch. 3, Ep. 10)",Video,You Choose!,3/13/2024,,,https://www.youtube.com/watch?v=AKmDmhd5hpQ,
Breaking Minecraft & Mastering Kubernetes with Tanzu Developer Advocate Whitney Lee | TechCraft,Guest,Tech Craft,3/16/2024,,,https://www.youtube.com/watch?v=7klehZbC82s,
"Sometimes, Lipstick Is Exactly What a Pig Needs! - Abby Bangser, Syntasso & Whitney Lee, VMware",Presentation,KubeCon - Platform Engineering Day,3/20/2024,,Keynote,https://www.youtube.com/watch?v=VhloarnpxVo,
"Choose Your Own Adventure: The Struggle for Security - Whitney Lee, VMware & Viktor Farcic, Upbound",Presentation,KubeCon EU Paris,3/21/2024,,,https://www.youtube.com/watch?v=sCyCmV0YrKw,
KubeCon Europe 2024 highlights - Live discussion,Guest,Civo,3/29/2024,,,https://www.youtube.com/watch?v=ncHmqUuWe7I,
Choose Your Own Adventure: The Perilous Passage to Production,Presentation,Cloud Native Rejekts,3/29/2024,,,https://www.youtube.com/watch?v=fEzAkFlGIkc,
"Grand Finale - End to End Demo of the Chosen Tech (You Choose!, Ch. 3, Ep. 11)",Video,You Choose!,4/2/2024,,,https://www.youtube.com/watch?v=7-3dVxmG9qs,
Security Showdown: The Overconfident Operator Vs the Nefarious Ne’er-Do-Well | CCOSS + KCD GDL,Presentation,KCD Guadalajara,4/24/2024,,Keynote,https://www.youtube.com/watch?v=I5l87LgYz9M,
CNL: Tetragon in action - detect & nip Kubernetes attacks in the bud,Video,Cloud Native Live,4/25/2024,,,https://www.youtube.com/watch?v=ji8uo69O8-I,
Cloud Native Live: Cloud Native Policy as code with Kyverno!,Video,Cloud Native Live,5/15/2024,,,https://www.youtube.com/watch?v=McNNejbyDc0,
Cloud Native Live: Finding infrastructure as code missteps,Video,Cloud Native Live,5/22/2024,,,https://www.youtube.com/watch?v=NA24C5ZqFlo,
Evolving Multi-tenant Kubernetes Log Collection with the Logging Operator,Video,⚡️Enlightning,5/23/2024,,,https://www.youtube.com/watch?v=CPh6GIhJ1JU,
An Introduction to Fluentd and Fluent Bit,Video,⚡️Enlightning,5/25/2024,,,https://www.youtube.com/watch?v=qhgQ0WD1i8c,
How to Platform Engineering “Well” for Target “Communities” | Ep 108,Guest,Cloud Native Podcast,5/30/2024,,,https://www.youtube.com/watch?v=3gv8eKeOIlI,
Exploring Distributed Tracing with Jaeger,Video,⚡️Enlightning,5/31/2024,,,https://www.youtube.com/watch?v=wsm_Tz1I5_8,
Cloud Native Live: AI across devices,Video,Cloud Native Live,6/5/2024,,,https://www.youtube.com/watch?v=-KhK-TtiWHs,
Observability 2.0: Not Just Another Buzzword,Video,⚡️Enlightning,6/7/2024,,,https://www.youtube.com/watch?v=dcVD6sNtAiI,
Two Friends Talking Tanzu Preview,Video,Two Friends Talking Tanzu,6/11/2024,,,https://www.youtube.com/watch?v=4Dt1fqyxp28,
Victor Farcic & Whitney Lee - Choose Your Own Adventure: The Struggle for Security,Presentation,KCD Zurich,6/24/2024,,,https://www.youtube.com/watch?v=sXbH-CPL4f0,
CNL: Intent-based access control at scale,Video,Cloud Native Live,6/26/2024,,,https://www.youtube.com/watch?v=3NS7S8qBnYs,
Two Friends Talking Tanzu - What Is VMware Tanzu? Part 1: The Problem,Video,Two Friends Talking Tanzu,7/2/2024,,,https://www.youtube.com/watch?v=xR58BFg9BzM,
Two Friends Talking Tanzu - What Is VMware Tanzu? Part 2: Build and Package,Video,Two Friends Talking Tanzu,7/2/2024,,,https://www.youtube.com/watch?v=yymW8hDnqbM,
Two Friends Talking Tanzu - What Is VMware Tanzu? Part 3: Deploy and Bind,Video,Two Friends Talking Tanzu,7/2/2024,,,https://www.youtube.com/watch?v=-gQHXKF0z2A,
Two Friends Talking Tanzu - What Is VMware Tanzu? Part 4: Tanzu Hub,Video,Two Friends Talking Tanzu,7/2/2024,,,https://www.youtube.com/watch?v=oMkYDqb6WWk,
Two Friends Talking Tanzu - What Is VMware Tanzu? Part 5: Conclusion and Recap,Video,Two Friends Talking Tanzu,7/2/2024,,,https://www.youtube.com/watch?v=MAwElwuhLAw,
Cloud Native Live: Dumbing down developer platform consoles,Video,Cloud Native Live,7/10/2024,,,https://www.youtube.com/watch?v=nD2LUZLPQKY,
Micrometer Mastery: Unleash Advanced Observability in Your JVM Apps,Video,⚡️Enlightning,7/11/2024,,,https://www.youtube.com/watch?v=hWr_mo5uKPY,
Monitoring Kubernetes Clusters,Video,⚡️Enlightning,7/16/2024,,,https://www.youtube.com/watch?v=LRXU-cj6CDA,
CNL: Unlocking K8s jobs and CronJobs with the spin command trigger,Video,Cloud Native Live,7/17/2024,,,https://www.youtube.com/watch?v=HRjVwM605zY,
What Is Tanzu? A Conversation Summary from Two Friends Talking Tanzu,Blog,VMware Tanzu,7/17/2024,,,https://tanzu.vmware.com/content/blog/two-friends-talking-tanzu,
Instant Observability: Exploring the Magic of Pixie,Video,⚡️Enlightning,7/19/2024,,,https://www.youtube.com/watch?v=WuqM7WCYj8o,
Make Your Own Kubernetes User Experience with Headlamp!,Video,⚡️Enlightning,7/20/2024,,,https://www.youtube.com/watch?v=hR-koOUsaMA,
Progressive Delivery for Kubernetes with Argo Rollouts!,Video,⚡️Enlightning,7/26/2024,,,https://www.youtube.com/watch?v=32Q8w1gL3NU,
Power Your Metrics with Prometheus,Video,⚡️Enlightning,7/27/2024,,,https://www.youtube.com/watch?v=gt085CrPRb8,
Scaling Your Metrics with Thanos,Video,⚡️Enlightning,8/2/2024,,,https://www.youtube.com/watch?v=1qvcVJiVx7M,
Recommended Practices for Logging with Grafana Loki,Video,⚡️Enlightning,8/3/2024,,,https://www.youtube.com/watch?v=zx7sRNpL9Ac,
